{
 "schema": "orbis-target/1",
 "id": "cuh-11xx",
 "kind": "model",
 "name": "PS4 CUH-11xx (Fat revision)",
 "extends": "common",
 "family": "fat",
 "southbridge": "aeolia",
 "apu": "liverpool-fat",
 "models": [
  "CUH-11??*"
 ],
 "chassis": "1100",
 "motherboards": [
  "SAB-001"
 ],
 "wifi_bt": [
  "Marvell 88W8797 (Torus 1)",
  "unknown on some boards"
 ],
 "unified_memory": {
  "pool_gib": 8,
  "carveout": "loader vram.txt (GE loader: multiple of 16 MiB, 64-4096 MiB)",
  "gtt_budget": "runtime (orbis_gtt_budget, ge-0008/0016)",
  "reclaim": "ge-0014 opt-in (amdgpu.orbis_shrinker=1)",
  "per_app_limits": "dmem vram + gtt (ge-0015, admission)",
  "zero_copy": "VK_EXT_external_memory_host via userptr+HMM; verified only by orbis-mem bench on the console",
  "xnack": "hardware-limited: GFX7 has no XNACK, so SVM/HMM fault replay is unavailable",
  "cus": 18,
  "state": "awaiting-hardware"
 },
 "notes": [
  "Wi-Fi chip of CUH-1116A unknown (feeRnt table)."
 ]
}
