{
 "schema": "orbis-target/1",
 "id": "cuh-22xx-belize2",
 "kind": "model",
 "name": "PS4 Slim CUH-22xx (Belize 2 board)",
 "extends": "common",
 "family": "slim",
 "southbridge": "belize2",
 "apu": "liverpool-slim",
 "models": [
  "CUH-22??*"
 ],
 "chassis": "2200",
 "motherboards": [
  "SAF-003",
  "SAF-005"
 ],
 "wifi_bt": [
  "MediaTek MT7668"
 ],
 "unified_memory": {
  "pool_gib": 8,
  "carveout": "loader vram.txt (GE loader: multiple of 16 MiB, 64-4096 MiB)",
  "gtt_budget": "runtime (orbis_gtt_budget, ge-0008/0016)",
  "reclaim": "ge-0014 opt-in (amdgpu.orbis_shrinker=1)",
  "per_app_limits": "dmem vram + gtt (ge-0015, admission)",
  "zero_copy": "VK_EXT_external_memory_host via userptr+HMM; verified only by orbis-mem bench on the console",
  "xnack": "hardware-limited: GFX7 has no XNACK, so SVM/HMM fault replay is unavailable",
  "cus": 18,
  "state": "awaiting-hardware"
 },
 "notes": [
  "feeRnt lists a CUH-2216A with a Belize southbridge on 5.15.15."
 ]
}
