{
 "schema": "orbis-target/1",
 "id": "gladius",
 "kind": "apu",
 "name": "Gladius / Neo (CUH-7xxx Pro)",
 "gpu": {
  "pci_vendor": "0x1002",
  "pci_device": "0x9924",
  "amdgpu_chip": "CHIP_GLADIUS",
  "compute_units": 36,
  "process": "16 nm"
 },
 "hdmi_bridge": "MN864729",
 "memory": {
  "gddr5_bytes": 8589934592,
  "peak_bandwidth_gbs": 218
 },
 "notes": [
  "ps4_bridge.c: PCI_DEVICE_ID_CUH_7XXX; amdgpu_drv.c maps 0x9924 to CHIP_GLADIUS",
  "The Pro's extra 1 GiB DDR3 belongs to OrbisOS background tasks and is not part of the Linux pool"
 ],
 "sources": [
  {
   "name": "kernel tree include/linux/pci_ids.h + drivers/gpu/drm/amd/amdgpu/ps4_bridge.c",
   "url": "https://github.com/feeRnt/ps4-linux-12xx",
   "role": "Sony southbridge PCI IDs; GPU PCI IDs 0x9920 (CUH-11xx), 0x9922 (CUH-12xx), 0x9923 (CUH-2xxx), 0x9924 (CUH-7xxx)"
  }
 ]
}
